{
  "schema_version": "0.11.0",
  "file_type": "links",
  "include": [],
  "links": {
    "pe_port": {
      "protocol": "custom",
      "custom": {
        "handshake": {
          "request_strobes": "single_valid_with_rw",
          "accept": "ready",
          "read_data_return": "valid_flag"
        },
        "channels": {
          "address": "shared",
          "data": "split_read_write"
        },
        "address_granularity": "byte",
        "address_width_bits": 32,
        "address_alignment_bytes": 4,
        "read_width_bits": 32,
        "write_width_bits": 32,
        "write_granularity_bytes": 1,
        "read_byte_enables": false,
        "write_response": false,
        "outstanding_requests": 1
      },
      "master_port_type": "pe_mstr",
      "slave_port_type": "pe_slv"
    },
    "tl_l1i_l2": {
      "protocol": "tilelink",
      "arbitration": "none",
      "tilelink": {
        "conformance": "TL-UH",
        "data_bus_bytes": 32,
        "address_bits": 32,
        "size_bits": 3,
        "source_bits": 3,
        "sink_bits": 2
      },
      "master_port_type": "tl_mstr",
      "slave_port_type": "tl_slv"
    },
    "tl_l1d_l2": {
      "protocol": "tilelink",
      "arbitration": "none",
      "tilelink": {
        "conformance": "TL-C",
        "data_bus_bytes": 32,
        "address_bits": 32,
        "size_bits": 3,
        "source_bits": 4,
        "sink_bits": 2
      },
      "master_port_type": "tl_mstr",
      "slave_port_type": "tl_slv"
    },
    "tl_l2_mem": {
      "protocol": "tilelink",
      "arbitration": "none",
      "tilelink": {
        "conformance": "TL-UH",
        "data_bus_bytes": 32,
        "address_bits": 32,
        "size_bits": 3,
        "source_bits": 5,
        "sink_bits": 3
      },
      "master_port_type": "tl_mstr",
      "slave_port_type": "tl_slv"
    }
  }
}